{
  "$schema": "../schema/edge.schema.json",
  "fhir_resource": "PractitionerRole",
  "omop_table": "provider",
  "direction": "fhir-to-omop",
  "status": "documented",
  "primary": true,
  "required": false,
  "condition": "PractitionerRole.practitioner references an existing Practitioner with a provider row",
  "narrative_md": "PractitionerRole enrichment of existing provider row. PractitionerRole does NOT create a new provider row; it adds specialty_concept_id, specialty_source_value, and care_site_id to the row created from the underlying Practitioner resource. One provider row per Practitioner; if multiple PractitionerRoles exist, choose the most recent or most specific.",
  "implementation_in_project": null,
  "fields": [
    {
      "omop_column": "specialty_concept_id",
      "fhir_path": "PractitionerRole.specialty[0].coding[0]",
      "fhir_type": "CodeableConcept",
      "omop_type": "integer",
      "required": false,
      "fk": "CONCEPT",
      "concept_map": "specialty",
      "notes": "SNOMED or NUCC specialty mapped to OMOP concept. Represents the most common or most specific specialty. 0 if unmapped. fhir-to-omop-demo extracts from PractitionerRole.specialty[0].coding[0] (lines 10-23, 44).",
      "sources": [
        {
          "comment": "Extracts from specialty[0].coding[0] with multi-coding warning; merges into provider row",
          "references": [
            { "project": "fhir-to-omop-demo", "kind": "jq", "path": "refs/refs/fhir-to-omop-demo/demo/translate/map/PractitionerRole.jq", "lines": [10, 53], "notes": "specialty extraction lines 10-23; merge lines 31-53; result at line 44" }
          ]
        },
        {
          "comment": "Does not process PractitionerRole; specialty left unmapped",
          "references": [
            { "project": "omoponfhir-v54", "kind": "java", "path": "refs/refs/omoponfhir-v54-r4/omoponfhir-omopv5-r4-mapping/src/main/java/edu/gatech/chai/omoponfhir/omopv5/r4/mapping/OmopPractitioner.java", "notes": "Only Practitioner resource is mapped; no PractitionerRole handling" }
          ]
        },
        {
          "comment": "Falls back to Practitioner.qualification[0].code when no PractitionerRole",
          "references": [
            { "project": "fhir-x-omop", "kind": "python", "path": "refs/refs/fhir-x-omop/fhir_x_omop/to_omop/provider.py", "lines": [31, 31] }
          ]
        }
      ]
    },
    {
      "omop_column": "specialty_source_value",
      "fhir_path": "PractitionerRole.specialty[0].coding[0].code",
      "fhir_type": "string",
      "omop_type": "varchar(50)",
      "required": false,
      "notes": "Raw specialty code as it appears in source data. Includes physician specialties (internal medicine, emergency medicine) and allied health professionals. fhir-to-omop-demo uses specialty.concept_code (line 49).",
      "sources": [
        {
          "comment": "Uses specialty.concept_code after OMOP lookup (post-translation value)",
          "references": [
            { "project": "fhir-to-omop-demo", "kind": "jq", "path": "refs/refs/fhir-to-omop-demo/demo/translate/map/PractitionerRole.jq", "lines": [49, 49] }
          ]
        },
        {
          "comment": "Uses qualification[0].code.coding[0].code from Practitioner (no PractitionerRole processing)",
          "references": [
            { "project": "fhir-x-omop", "kind": "python", "path": "refs/refs/fhir-x-omop/fhir_x_omop/to_omop/provider.py", "lines": [31, 31] }
          ]
        }
      ]
    },
    {
      "omop_column": "specialty_source_concept_id",
      "fhir_path": null,
      "fhir_type": "integer",
      "omop_type": "integer",
      "required": false,
      "constant": 0,
      "notes": "Often zero as many sites use proprietary codes to store physician specialty."
    },
    {
      "omop_column": "care_site_id",
      "fhir_path": "PractitionerRole.organization",
      "fhir_type": "Reference(Organization)",
      "omop_type": "integer",
      "required": false,
      "fk": "CARE_SITE",
      "notes": "Organization affiliation from PractitionerRole. This is the location that the provider primarily practices in. fhir-to-omop-demo uses location_ids[0] (line 45). omoponfhir creates a CareSite from the Practitioner's address if no PractitionerRole link exists.",
      "sources": [
        {
          "comment": "location_ids[0] resolved from PractitionerRole.location (not .organization directly)",
          "references": [
            { "project": "fhir-to-omop-demo", "kind": "jq", "path": "refs/refs/fhir-to-omop-demo/demo/translate/map/PractitionerRole.jq", "lines": [45, 45] }
          ]
        },
        {
          "comment": "Derived from Practitioner.address via AddressUtil — no PractitionerRole.organization used",
          "references": [
            { "project": "omoponfhir-v54", "kind": "java", "path": "refs/refs/omoponfhir-v54-r4/omoponfhir-omopv5-r4-mapping/src/main/java/edu/gatech/chai/omoponfhir/omopv5/r4/mapping/OmopPractitioner.java", "lines": [358, 375] }
          ]
        }
      ]
    }
  ],
  "vocabularies": [
    {
      "name": "specialty",
      "entries": [
        {
          "source_code": "207Q00000X",
          "source_display": "Family Medicine",
          "target_concept_id": 38004459,
          "target_concept_name": "Family Medicine",
          "notes": "NUCC Provider Taxonomy"
        },
        {
          "source_code": "207R00000X",
          "source_display": "Internal Medicine",
          "target_concept_id": 38004456,
          "target_concept_name": "Internal Medicine",
          "notes": "NUCC Provider Taxonomy"
        },
        {
          "source_code": "207V00000X",
          "source_display": "Obstetrics & Gynecology",
          "target_concept_id": 38004461,
          "target_concept_name": "Obstetrics/Gynecology",
          "notes": "NUCC Provider Taxonomy"
        },
        {
          "source_code": "208D00000X",
          "source_display": "General Practice",
          "target_concept_id": 38004446,
          "target_concept_name": "General Practice",
          "notes": "NUCC Provider Taxonomy"
        },
        {
          "source_code": "208600000X",
          "source_display": "Surgery",
          "target_concept_id": 38004447,
          "target_concept_name": "Surgery",
          "notes": "NUCC Provider Taxonomy"
        },
        {
          "source_code": "(unmapped)",
          "source_display": "Unmapped specialty",
          "target_concept_id": 0,
          "target_concept_name": "No matching concept",
          "notes": "Default when specialty system not recognized or code not in OMOP vocabulary"
        }
      ]
    }
  ],
  "concept_maps": ["specialty"],
  "references": [
    {
      "project": "fhir-to-omop-demo",
      "kind": "jq",
      "path": "refs/refs/fhir-to-omop-demo/demo/translate/map/PractitionerRole.jq",
      "lines": [1, 80],
      "notes": "Specialty extraction with multi-coding warning (lines 10-23), merge-based approach where PractitionerRole enriches the provider row (lines 31-53), care_site_id from location_ids[0] (line 45), specialty.concept_code -> specialty_source_value (line 49)."
    },
    {
      "project": "fhir-omop-ig",
      "kind": "fsh",
      "path": "refs/refs/fhir-omop-ig/input/fsh/Provider.fsh",
      "notes": "All 13 provider fields defined including specialty_concept_id and care_site_id."
    },
    {
      "project": "omoponfhir-v54",
      "kind": "java",
      "path": "refs/refs/omoponfhir-v54-r4/omoponfhir-omopv5-r4-mapping/src/main/java/edu/gatech/chai/omoponfhir/omopv5/r4/mapping/OmopPractitioner.java",
      "notes": "Does NOT process PractitionerRole as a separate resource; only the Practitioner resource is mapped. Specialty is not populated. care_site_id is derived from Practitioner.address instead."
    },
    {
      "project": "fhir-x-omop",
      "kind": "python",
      "path": "refs/refs/fhir-x-omop/fhir_x_omop/to_omop/provider.py",
      "notes": "No dedicated PractitionerRole mapper. Falls back to Practitioner.qualification[0].code for specialty_source_value."
    }
  ],
  "edge_cases": [
    {
      "case": "Multiple PractitionerRoles for same Practitioner",
      "handling": "Single provider row. Use first/most-recent role (by period.end) for specialty and care_site. Log if multiple roles found.",
      "implementations": ["fhir-to-omop-demo"]
    },
    {
      "case": "PractitionerRole without Practitioner reference",
      "handling": "Cannot create or enrich provider row (no identity). Log and skip."
    },
    {
      "case": "Specialty system not recognized (not NUCC, not SNOMED)",
      "handling": "specialty_concept_id = 0, specialty_source_value = raw code."
    },
    {
      "case": "PractitionerRole.organization references Organization not in bundle",
      "handling": "Deferred resolution. Stub care_site_id; resolve when Organization arrives."
    }
  ]
}
